<?xml version="1.0" encoding="UTF-8"?>
<tns:employees xmlns:tns="http://www.ivy.com/employees" xmlns:xsi="http://www.w3.org/2001/XMLSchema-instance" xsi:schemaLocation="http://www.ivy.com/employees employees.xsd ">
  <companyName>ivy</companyName>
  <employee>
    <id>1</id>
    <name>name</name>
    <address>address</address>
    <dob>2001-01-01</dob>
  </employee>
   <employee>
    <id>3</id>
    <name>name</name>
    <address>address</address>
    <dob>2001-01-01</dob>
  </employee>
</tns:employees>
